{
  "id": "cec3fa65-0ad2-4d5b-8e84-680690de6bab",
  "courseId": "course-001",
  "lectureId": "test-beginner",
  "presetId": "beginner-mode",
  "artifactType": "exam-questions",
  "generatedAt": "2026-02-11T09:33:47.109866+00:00",
  "version": "0.2",
  "threadRefs": [
    "2c5e7d74-d171-4e8c-9dca-704c0ab9f42d",
    "b14644ae-ac3e-4093-ba7d-c94d03250d67",
    "02dcda68-b5ba-4465-9797-834087a28b27"
  ],
  "questions": [
    {
      "prompt": "Which component is most associated with the primary process?",
      "type": "multiple-choice",
      "choices": [
        "Component A (primary)",
        "Component B (secondary)",
        "Component C (regulatory)",
        "Component D (auxiliary)"
      ],
      "correctChoiceIndex": 0,
      "answer": "Component A (primary).",
      "threadRef": "b14644ae-ac3e-4093-ba7d-c94d03250d67"
    },
    {
      "prompt": "Explain the enhanced process in one paragraph.",
      "type": "essay",
      "answer": "The enhanced process describes how optimization factors enable more efficient system operation, which improves performance and reduces resource requirements."
    }
  ]
}
