{
  "id": "d5e47483-6e8b-4631-a78a-d5c9a4bc4d12",
  "courseId": "test-course",
  "lectureId": "test-001",
  "presetId": "exam-mode",
  "artifactType": "exam-questions",
  "generatedAt": "2026-02-11T09:32:48.248331+00:00",
  "version": "0.2",
  "threadRefs": [
    "b3d7250f-5901-4c41-91e3-1cb66c08c18f",
    "638ea655-2b98-4961-8546-781c2043b105",
    "f50e7c7a-f48f-4f0c-a618-2ce4da7163d1"
  ],
  "questions": [
    {
      "prompt": "Which component is most associated with the primary process?",
      "type": "multiple-choice",
      "choices": [
        "Component A (primary)",
        "Component B (secondary)",
        "Component C (regulatory)",
        "Component D (auxiliary)"
      ],
      "correctChoiceIndex": 0,
      "answer": "Component A (primary).",
      "threadRef": "638ea655-2b98-4961-8546-781c2043b105"
    },
    {
      "prompt": "Explain the enhanced process in one paragraph.",
      "type": "essay",
      "answer": "The enhanced process describes how optimization factors enable more efficient system operation, which improves performance and reduces resource requirements."
    }
  ]
}
