{
  "id": "e12847fd-3f5c-427a-a80c-b4ed3affd26f",
  "courseId": "course-001",
  "lectureId": "test-research",
  "presetId": "research-mode",
  "artifactType": "exam-questions",
  "generatedAt": "2026-02-11T09:33:59.940541+00:00",
  "version": "0.2",
  "threadRefs": [
    "2c5e7d74-d171-4e8c-9dca-704c0ab9f42d",
    "b14644ae-ac3e-4093-ba7d-c94d03250d67",
    "02dcda68-b5ba-4465-9797-834087a28b27"
  ],
  "questions": [
    {
      "prompt": "Summarize evidence for optimization affecting system efficiency.",
      "type": "short-answer",
      "answer": "Summarize cited data or experiments. [evidence]"
    },
    {
      "prompt": "What competing hypotheses explain mechanism strengthening?",
      "type": "essay",
      "answer": "List and contrast candidate mechanisms. [evidence]"
    }
  ]
}
